{
  "$schema": "https://json-schema.org/draft/2020-12/schema",
  "title": "LayerRelay configuration",
  "type": "object",
  "additionalProperties": false,
  "required": ["printerHost", "username", "password"],
  "properties": {
    "$schema": { "type": "string" },
    "printerHost": { "type": "string", "minLength": 1, "description": "PrusaLink hostname or IP address, without a URL scheme." },
    "username": { "type": "string", "minLength": 1, "description": "PrusaLink Digest authentication username." },
    "password": { "type": "string", "minLength": 1, "writeOnly": true, "description": "PrusaLink password. Keep config.json private." },
    "listenHost": { "type": "string", "minLength": 1, "default": "127.0.0.1" },
    "port": { "type": "integer", "minimum": 1, "maximum": 65535, "default": 8787 },
    "sourceCodeUrl": {
      "type": "string",
      "pattern": "^https?://",
      "default": "https://github.com/GoByeBye/LayerRelay",
      "description": "Public corresponding-source URL shown to remote users. Modified deployments must point this at their exact source."
    },
    "pollIntervalMs": { "type": "integer", "minimum": 250, "default": 2000 },
    "analysisCacheMaxEntries": { "type": "integer", "minimum": 1, "maximum": 1000, "default": 100 },
    "analysisCacheMaxBytes": { "type": "integer", "minimum": 1048576, "maximum": 1073741824, "default": 67108864 },
    "printNameOverrides": {
      "type": "object",
      "additionalProperties": { "type": "string", "maxLength": 200 },
      "default": {}
    },
    "toolCount": {
      "description": "Manual tool-count override. Use null to detect the inventory from Prusa Connect.",
      "default": null,
      "anyOf": [
        { "type": "null" },
        { "type": "integer", "minimum": 1, "maximum": 32 }
      ]
    },
    "toolSettingsAllowedOrigins": {
      "type": "array",
      "maxItems": 16,
      "uniqueItems": true,
      "items": { "type": "string", "pattern": "^https?://[^/]+$" },
      "default": [],
      "description": "Exact additional browser origins allowed to write tool settings, for authenticated reverse proxies or named hosts. Loopback and literal IP origins work without entries."
    },
    "apiReadAllowedOrigins": {
      "type": "array",
      "maxItems": 16,
      "uniqueItems": true,
      "items": { "type": "string", "pattern": "^https?://[^/]+$" },
      "default": [],
      "description": "Exact browser origins allowed to read /api/* responses cross-origin, for the static GitHub Pages dashboard's live bridge. Empty keeps the API same-origin only."
    },
    "toolSlots": {
      "type": "object",
      "patternProperties": {
        "^(?:[1-9]|[12][0-9]|3[0-2])$": {
          "type": "object",
          "additionalProperties": false,
          "properties": {
            "loaded": { "type": "boolean" },
            "name": { "type": "string", "maxLength": 80 },
            "color": { "type": "string", "pattern": "^#[0-9A-Fa-f]{6}$" }
          }
        }
      },
      "additionalProperties": false,
      "default": {}
    },
    "localBgcodeDirs": { "type": "array", "items": { "type": "string", "minLength": 1 }, "default": [] },
    "cameraRtspUrl": {
      "writeOnly": true,
      "default": "",
      "description": "Private RTSP source. Buddy3D uses an unauthenticated local URL without embedded credentials; other cameras may include credentials.",
      "anyOf": [
        { "const": "" },
        { "type": "string", "pattern": "^rtsps?://" }
      ]
    },
    "cameraStreamEnabled": { "type": "boolean", "description": "When omitted, a non-empty cameraRtspUrl enables the relay automatically." },
    "cameraFfmpegPath": { "type": "string", "minLength": 1, "default": "ffmpeg" },
    "cameraStreamFps": { "type": "integer", "minimum": 1, "maximum": 30, "default": 24 },
    "cameraStreamWidth": { "type": "integer", "minimum": 320, "maximum": 3840, "default": 1920 },
    "cameraStreamJpegQuality": { "type": "integer", "minimum": 2, "maximum": 31, "default": 5 },
    "cameraStreamThreads": { "type": "integer", "minimum": 1, "maximum": 16, "default": 4 },
    "cameraStreamKillGraceMs": { "type": "integer", "minimum": 500, "maximum": 10000, "default": 3000 },
    "cameraStreamIdleMs": { "type": "integer", "minimum": 1000, "maximum": 300000, "default": 10000 },
    "cameraStreamStallMs": { "type": "integer", "minimum": 5000, "maximum": 120000, "default": 20000 },
    "cameraStreamIoTimeoutMs": { "type": "integer", "minimum": 3000, "maximum": 120000, "default": 15000 },
    "cameraStreamRestartBaseMs": { "type": "integer", "minimum": 250, "maximum": 30000, "default": 1000 },
    "cameraStreamRestartMaxMs": { "type": "integer", "minimum": 1000, "maximum": 120000, "default": 15000 },
    "cameraStreamMaxFrameBytes": { "type": "integer", "minimum": 1048576, "maximum": 67108864, "default": 16777216 },
    "nozzleRtspUrl": {
      "writeOnly": true,
      "default": "",
      "description": "Optional secondary (nozzle) RTSP source relayed to /api/nozzle.mjpeg. Same handling as cameraRtspUrl.",
      "anyOf": [
        { "const": "" },
        { "type": "string", "pattern": "^rtsps?://" }
      ]
    },
    "nozzleStreamEnabled": { "type": "boolean", "description": "When omitted, a non-empty nozzleRtspUrl enables the nozzle relay automatically." },
    "nozzleStreamFps": { "type": "integer", "minimum": 1, "maximum": 30, "default": 15 },
    "nozzleStreamWidth": { "type": "integer", "minimum": 320, "maximum": 3840, "default": 640 },
    "nozzleStreamJpegQuality": { "type": "integer", "minimum": 2, "maximum": 31, "default": 6 },
    "nozzlePipUrl": {
      "default": "",
      "description": "Optional browser-facing stream URL (e.g. go2rtc MJPEG) for the nozzle PiP, bypassing LayerRelay's relay for lower latency.",
      "anyOf": [ { "const": "" }, { "type": "string", "pattern": "^(https?://|/)" } ]
    },
    "timelapseUrl": {
      "default": "",
      "description": "Optional http(s) URL to a timelapse gallery; shown as a link in the dashboard controls.",
      "anyOf": [ { "const": "" }, { "type": "string", "pattern": "^https?://" } ]
    },
    "useConnect": { "type": "boolean", "default": true, "description": "Use Prusa Connect when both the printer UUID and refresh token are configured. Set false for an intentional PrusaLink-only deployment." },
    "connectPrinterUuid": { "type": "string", "default": "" },
    "connectPollMs": { "type": "integer", "minimum": 5000, "default": 5000 },
    "connectClientId": { "type": "string", "description": "Optional override for the experimental integration's built-in public browser client ID." },
    "connectRefreshToken": { "type": "string", "writeOnly": true, "default": "" },
    "useNetatmo": { "type": "boolean", "description": "Explicitly enable or disable Netatmo. When omitted, complete credentials enable it." },
    "netatmoClientId": { "type": "string", "writeOnly": true, "default": "" },
    "netatmoClientSecret": { "type": "string", "writeOnly": true, "default": "" },
    "netatmoRefreshToken": { "type": "string", "writeOnly": true, "default": "" },
    "netatmoPollMs": { "type": "integer", "minimum": 60000, "default": 300000 },
    "lastStateWriteMs": { "type": "integer", "minimum": 5000, "default": 10000 },
    "maxPrinterJsonBytes": { "type": "integer", "minimum": 1024, "default": 1048576 },
    "maxPrinterResponseBytes": { "type": "integer", "minimum": 1024, "default": 536870912 }
  }
}
